{
  "$schema": "https://json-schema.org/draft/2020-12/schema",
  "$id": "https://raw.githubusercontent.com/keepwhatworks/trinity/main/schemas/eval_set.schema.json",
  "title": "Trinity Eval Set",
  "description": "Personalized eval suite built from the user's empirical rejection signal. Each item is a (prompt, rejected_response, rejection_type) triple any candidate model can be scored against. Generated by `trinity-local eval-build`; lives at ~/.trinity/evals/<eval_id>.json. Replayable when new models ship: same eval_id, new model, new result file in ~/.trinity/evals/results/. Only Trinity can build this — no provider has cross-provider rejection signal.",
  "type": "object",
  "required": [
    "eval_id",
    "built_at",
    "source",
    "stats",
    "items"
  ],
  "properties": {
    "eval_id": {
      "type": "string",
      "description": "Content-addressed id (hash of source_ids). Same corpus state → same id, so re-running on unchanged corpus is idempotent and adding new rejections produces a new id (historical results stay pinned to the corpus state they scored against).",
      "pattern": "^eval_[a-f0-9]{12}$"
    },
    "built_at": {
      "type": "string",
      "format": "date-time"
    },
    "source": {
      "type": "string",
      "enum": [
        "rejections",
        "cross_provider_pair"
      ],
      "description": "Which signal source produced the items. MVP supports `rejections` (turn-pair gap labels from ~/.trinity/me/rejections.jsonl). `cross_provider_pair` lands in a follow-up tick — same prompt asked of multiple providers."
    },
    "stats": {
      "type": "object",
      "required": [
        "items"
      ],
      "properties": {
        "items": {
          "type": "integer",
          "minimum": 0
        },
        "by_rejection_type": {
          "type": "object",
          "description": "Count of items per rejection_type, sorted descending. The dominant axis is the strongest benchmark signal for this user.",
          "additionalProperties": {
            "type": "integer",
            "minimum": 0
          }
        },
        "by_basin": {
          "type": "object",
          "description": "Count of items per basin (topic cluster). Lets per-basin × rejection_type aggregation in scoring.",
          "additionalProperties": {
            "type": "integer",
            "minimum": 0
          }
        }
      }
    },
    "items": {
      "type": "array",
      "items": {
        "$ref": "#/$defs/eval_item"
      }
    }
  },
  "$defs": {
    "eval_item": {
      "type": "object",
      "required": [
        "eval_item_id",
        "prompt",
        "rejection_type",
        "rejected_response",
        "source",
        "source_id"
      ],
      "properties": {
        "eval_item_id": {
          "type": "string",
          "pattern": "^ei_[a-f0-9]{12}$"
        },
        "prompt": {
          "type": "string",
          "description": "The original user prompt that elicited the rejected response. Falls back to `user_substitute` when the prompt index has churned and the prompt_id no longer resolves."
        },
        "rejection_type": {
          "type": "string",
          "enum": [
            "REFRAME",
            "COMPRESSION",
            "REDIRECT",
            "SHARPENING"
          ],
          "description": "The four taste-terminal implicit rejection signal types. REFRAME: user substitutes a different frame. COMPRESSION: user wanted shorter. REDIRECT: user wanted a different topic entirely. SHARPENING: user wanted more precision on the same topic."
        },
        "rejected_response": {
          "type": "string",
          "description": "The assistant's response that triggered the user's rejection (model_quote in rejections.jsonl)."
        },
        "user_substitute": {
          "type": "string",
          "description": "What the user actually wanted (their next-turn correction)."
        },
        "rubric_signal": {
          "type": "string",
          "description": "Chairman-extracted why_signal — used by the scorer to know which axis to judge on."
        },
        "basin_id": {
          "type": [
            "string",
            "null"
          ],
          "description": "Topic cluster from topics.json. Enables per-basin × rejection_type benchmark aggregation."
        },
        "source": {
          "type": "string",
          "enum": [
            "rejections",
            "cross_provider_pair"
          ]
        },
        "source_id": {
          "type": "string",
          "description": "The RejectionSignal.id (or cross-pair id when source=cross_provider_pair) this item was derived from."
        },
        "prompt_id": {
          "type": [
            "string",
            "null"
          ],
          "description": "PromptNode id when the original prompt was indexed. May be null when the prompt couldn't be located."
        },
        "provider_of_rejected_response": {
          "type": [
            "string",
            "null"
          ],
          "description": "Which provider produced the rejected response (claude/codex/antigravity/...). Lets benchmarks report 'this model got rejected on N of M, the new model scored X' with provider attribution."
        },
        "cold_answerable": {
          "type": "boolean",
          "description": "Whether the prompt can be answered COLD (no conversation/image context) — the head-to-head dispatch filter. Stamped at eval-build; legacy sets classify at load."
        },
        "cold_reason": {
          "type": "string",
          "description": "Why the classifier decided (self-contained / fragment / image-grounded / conversational continuation / bare deictic)."
        }
      }
    }
  }
}
